[
  {
    "format_version": 1,
    "kind": "work-evidence",
    "id": "evidence:example:test-pass",
    "work_unit_id": "wu:example-coding-agent",
    "provenance": {
      "run_id": "run:example-coding-agent",
      "task_id": "task:test",
      "attempt_id": "attempt:example:test:1"
    },
    "evidence_kind": "captured_fact",
    "status": "verified",
    "subject": "Focused test result",
    "source": {
      "kind": "test",
      "reference": "fixture:test:focused",
      "digest": "sha256:1111111111111111111111111111111111111111111111111111111111111111",
      "revision": "fixture-v1"
    },
    "derived_from": [],
    "payload": {
      "mode": "inline_json",
      "content_ref": null,
      "text": null,
      "value": {
        "command": "synthetic-test",
        "exit_code": 0,
        "passed": true
      },
      "digest": "sha256:2222222222222222222222222222222222222222222222222222222222222222",
      "mime_type": "application/json",
      "size_bytes": 64,
      "redaction_ref": null
    },
    "unavailability_reason": null,
    "sensitivity": "project",
    "created_at": "2026-09-23T05:41:44Z"
  }
]
